{
  "version": 1,
  "name": "Premium Sportscar",
  "description": "High-performance grand tourer with full driver assists: 4-channel ABS, traction control, VSC/ESC, and complete ADAS suite.",
  "massProperties": {
    "totalMass": 1600,
    "centerOfMass": { "x": 0, "y": 0.3, "z": 0.25 },
    "inertia": { "x": 900, "y": 2600, "z": 2900 }
  },
  "weightDistribution": { "front": 0.45, "rear": 0.55 },
  "drivetrain": { "layout": "rwd" },
  "aerodynamics": {
    "frontalArea": 2.05,
    "dragCoefficient": 0.31,
    "liftCoefficient": -0.18,
    "centerOfPressure": { "x": 0, "y": 0.62, "z": 0.3 }
  },
  "nodes": [
    { "id": 0, "x": -0.8, "y": 0.0, "z": -1.35, "mass": 110, "fixed": false },
    { "id": 1, "x": 0.8, "y": 0.0, "z": -1.35, "mass": 110, "fixed": false },
    { "id": 2, "x": -0.8, "y": 0.0, "z": 1.35, "mass": 140, "fixed": false },
    { "id": 3, "x": 0.8, "y": 0.0, "z": 1.35, "mass": 140, "fixed": false },
    { "id": 4, "x": -0.8, "y": 0.45, "z": -1.35, "mass": 70, "fixed": false },
    { "id": 5, "x": 0.8, "y": 0.45, "z": -1.35, "mass": 70, "fixed": false },
    { "id": 6, "x": -0.8, "y": 0.45, "z": 1.35, "mass": 100, "fixed": false },
    { "id": 7, "x": 0.8, "y": 0.45, "z": 1.35, "mass": 100, "fixed": false },
    { "id": 8, "x": -0.65, "y": 0.7, "z": -0.75, "mass": 180, "fixed": false },
    { "id": 9, "x": 0.65, "y": 0.7, "z": -0.75, "mass": 180, "fixed": false },
    { "id": 10, "x": -0.65, "y": 0.7, "z": 0.75, "mass": 200, "fixed": false },
    { "id": 11, "x": 0.65, "y": 0.7, "z": 0.75, "mass": 200, "fixed": false }
  ],
  "beams": [
    { "id": 0, "nodeA": 0, "nodeB": 1, "stiffness": 1400000, "damping": 0.5, "strength": 112000 },
    { "id": 1, "nodeA": 2, "nodeB": 3, "stiffness": 1400000, "damping": 0.5, "strength": 112000 },
    { "id": 2, "nodeA": 4, "nodeB": 5, "stiffness": 1400000, "damping": 0.5, "strength": 112000 },
    { "id": 3, "nodeA": 6, "nodeB": 7, "stiffness": 1400000, "damping": 0.5, "strength": 112000 },
    { "id": 4, "nodeA": 8, "nodeB": 9, "stiffness": 1000000, "damping": 0.45, "strength": 72000 },
    { "id": 5, "nodeA": 10, "nodeB": 11, "stiffness": 1000000, "damping": 0.45, "strength": 72000 },
    { "id": 6, "nodeA": 0, "nodeB": 2, "stiffness": 1200000, "damping": 0.55, "strength": 96000 },
    { "id": 7, "nodeA": 1, "nodeB": 3, "stiffness": 1200000, "damping": 0.55, "strength": 96000 },
    { "id": 8, "nodeA": 4, "nodeB": 6, "stiffness": 1200000, "damping": 0.55, "strength": 96000 },
    { "id": 9, "nodeA": 5, "nodeB": 7, "stiffness": 1200000, "damping": 0.55, "strength": 96000 },
    { "id": 10, "nodeA": 0, "nodeB": 4, "stiffness": 1600000, "damping": 0.65, "strength": 128000 },
    { "id": 11, "nodeA": 1, "nodeB": 5, "stiffness": 1600000, "damping": 0.65, "strength": 128000 },
    { "id": 12, "nodeA": 2, "nodeB": 6, "stiffness": 1600000, "damping": 0.65, "strength": 128000 },
    { "id": 13, "nodeA": 3, "nodeB": 7, "stiffness": 1600000, "damping": 0.65, "strength": 128000 },
    { "id": 14, "nodeA": 4, "nodeB": 8, "stiffness": 1000000, "damping": 0.5, "strength": 80000 },
    { "id": 15, "nodeA": 5, "nodeB": 9, "stiffness": 1000000, "damping": 0.5, "strength": 80000 },
    { "id": 16, "nodeA": 6, "nodeB": 10, "stiffness": 1000000, "damping": 0.5, "strength": 80000 },
    { "id": 17, "nodeA": 7, "nodeB": 11, "stiffness": 1000000, "damping": 0.5, "strength": 80000 },
    { "id": 18, "nodeA": 8, "nodeB": 10, "stiffness": 800000, "damping": 0.4, "strength": 60000 },
    { "id": 19, "nodeA": 9, "nodeB": 11, "stiffness": 800000, "damping": 0.4, "strength": 60000 },
    { "id": 20, "nodeA": 0, "nodeB": 3, "stiffness": 800000, "damping": 0.45, "strength": 64000 },
    { "id": 21, "nodeA": 1, "nodeB": 2, "stiffness": 800000, "damping": 0.45, "strength": 64000 }
  ],
  "engine": {
    "idleRpm": 850,
    "redlineRpm": 8000,
    "revLimiterRpm": 8200,
    "displacement": 3.8,
    "turboBoost": 1.2,
    "thermalCapacity": 1800,
    "throttleResponse": 1.1,
    "engineBraking": 0.25,
    "torqueCurve": [
      [0, 150], [1000, 300], [2000, 420], [3000, 500],
      [4000, 540], [5000, 520], [6000, 480], [7000, 420], [8000, 350]
    ],
    "coolingSystem": {
      "radiatorCapacity": 2.8,
      "coolantCapacity": 2.0,
      "fanTemp": 93
    },
    "oilSystem": {
      "oilCapacity": 5.5,
      "pumpPressure": 60,
      "pickupPosition": 0.04
    }
  },
  "transmission": {
    "mode": "automatic",
    "autoShiftUpRpm": 5000,
    "autoShiftDownRpm": 2200,
    "gearRatios": [3.8, 2.4, 1.7, 1.2, 0.9, 0.7],
    "finalDrive": 3.4,
    "reverseRatio": -3.0,
    "clutchEngagement": 0.5,
    "shiftDelay": 0.1,
    "differential": {
      "type": "limited_slip",
      "bias": 0.55,
      "lockRatio": 0.4
    }
  },
  "suspension": {
    "springRate": 38000,
    "damping": 5200,
    "travel": 0.18,
    "antiRollBarStiffness": 2200,
    "wheels": [
      { "springRate": 36000, "damping": 5000, "reboundDamping": 3200, "restLength": 0.33, "travel": 0.18, "unsprungMass": 14, "tireRadius": 0.34 },
      { "springRate": 36000, "damping": 5000, "reboundDamping": 3200, "restLength": 0.33, "travel": 0.18, "unsprungMass": 14, "tireRadius": 0.34 },
      { "springRate": 40000, "damping": 5500, "reboundDamping": 3500, "restLength": 0.33, "travel": 0.18, "unsprungMass": 14, "tireRadius": 0.34 },
      { "springRate": 40000, "damping": 5500, "reboundDamping": 3500, "restLength": 0.33, "travel": 0.18, "unsprungMass": 14, "tireRadius": 0.34 }
    ]
  },
  "tires": [
    { "compound": "performance", "nominalPressure": 34, "wearRating": 300 },
    { "compound": "performance", "nominalPressure": 34, "wearRating": 300 },
    { "compound": "performance", "nominalPressure": 34, "wearRating": 300 },
    { "compound": "performance", "nominalPressure": 34, "wearRating": 300 }
  ],
  "brakes": [
    { "brakeTorqueMax": 3200, "ventilated": true },
    { "brakeTorqueMax": 3200, "ventilated": true },
    { "brakeTorqueMax": 3500, "ventilated": true },
    { "brakeTorqueMax": 3500, "ventilated": true }
  ],
  "fuel": {
    "capacity": 65,
    "consumptionRate": 0.015,
    "fuelDensity": 0.75,
    "idleConsumptionRate": 0.006
  },
  "damage": {
    "beamYieldStrength": 600,
    "crumpleZones": {
      "front": 0.55,
      "rear": 0.45,
      "sides": 0.35
    }
  },
  "body": {
    "bodyMesh": "/models/premium_sportscar.body.glb",
    "material": "aluminum",
    "crumpleFactor": 0.5,
    "geometry": {
      "length": 4.5,
      "width": 1.9,
      "height": 1.25,
      "wheelbase": 2.65,
      "frontTrack": 1.62,
      "rearTrack": 1.6,
      "groundClearance": 0.11
    }
  },
  "safety_systems": {
    "abs": {
      "enabled": true,
      "channels": 4,
      "wheel_speed_sensors": true,
      "slip_threshold": 0.12,
      "pump_latency": 0.015,
      "valve_latency": 0.008,
      "modes": ["enabled", "sport", "disabled"],
      "default_mode": "enabled"
    },
    "traction_control": {
      "enabled": true,
      "slip_threshold": 0.15,
      "throttle_reduction_max": 0.5,
      "brake_intervention": true,
      "modes": ["enabled", "sport", "disabled"],
      "default_mode": "enabled"
    },
    "vsc_esc": {
      "enabled": true,
      "yaw_rate_sensor": true,
      "lateral_accel_sensor": true,
      "individual_brake_vectoring": true,
      "torque_reduction": true,
      "yaw_error_threshold": 0.04,
      "modes": ["enabled", "sport", "disabled"],
      "default_mode": "enabled"
    },
    "adas": {
      "forward_collision_warning": true,
      "automatic_emergency_braking": true,
      "adaptive_cruise_control": true,
      "blind_spot_warning": true,
      "lane_departure_warning": true,
      "lane_departure_assist": true,
      "parking_sensors": true,
      "perception_range": 200,
      "radar_fov": 60,
      "camera_fov": 120
    }
  }
}
